{
  "platform": "saratoga_cv3",
  "description": "HVAC network synthesized for saratoga_cv3",
  "oa_fraction": 0.2,
  "hvac_duty": 0.5,
  "hvac_zones": [
    {
      "id": "VENT_Hangar",
      "rooms": [
        "Hangar_Aft",
        "Hangar_Mid",
        "Hangar_Fwd"
      ],
      "ach": 6.0,
      "description": "hangar deck side openings + fire-curtain segments; natural ventilation",
      "vent_mode": "nat_supply",
      "evidence": "sheet_read",
      "oa_fraction": 1.0
    },
    {
      "id": "AHU_HD_Wash_Room_Main",
      "rooms": [
        "Wash_Room_Main"
      ],
      "ach": 19.1,
      "oa_fraction": 1.0,
      "hvac_duty": 0.0,
      "description": "Exhaust-only sanitary branch (Wash_Room_Main, 14 WC); makeup air enters from the served space's branch and leaves overboard."
    },
    {
      "id": "AHU_HD_UHD_Head",
      "rooms": [
        "UHD_Head"
      ],
      "ach": 19.1,
      "oa_fraction": 1.0,
      "hvac_duty": 0.0,
      "description": "Exhaust-only sanitary branch (UHD_Head, 9 WC); makeup air enters from the served space's branch and leaves overboard."
    },
    {
      "id": "AHU_HD_Firemans_Wash_Rm",
      "rooms": [
        "Firemans_Wash_Rm"
      ],
      "ach": 19.1,
      "oa_fraction": 1.0,
      "hvac_duty": 0.0,
      "description": "Exhaust-only sanitary branch (Firemans_Wash_Rm, 14 WC); makeup air enters from the served space's branch and leaves overboard."
    },
    {
      "id": "AHU_HD_Mens_Wash_Rm",
      "rooms": [
        "Mens_Wash_Rm"
      ],
      "ach": 19.1,
      "oa_fraction": 1.0,
      "hvac_duty": 0.0,
      "description": "Exhaust-only sanitary branch (Mens_Wash_Rm, 12 WC); makeup air enters from the served space's branch and leaves overboard."
    },
    {
      "id": "AHU_HD_Head_2D",
      "rooms": [
        "Head_2D"
      ],
      "ach": 19.1,
      "oa_fraction": 1.0,
      "hvac_duty": 0.0,
      "description": "Exhaust-only sanitary branch (Head_2D, 12 WC); makeup air enters from the served space's branch and leaves overboard."
    }
  ],
  "cross_zone_links": [
    {
      "from": "VENT_Hangar",
      "to": "AHU_HD_Wash_Room_Main",
      "flow_rate_m3h": 1664.6,
      "is_hvac_ducted": false,
      "path": "Sanitary_Makeup",
      "description": "Transfer air into Wash_Room_Main; the head exhausts overboard, never back to the served space."
    },
    {
      "from": "VENT_Hangar",
      "to": "AHU_HD_UHD_Head",
      "flow_rate_m3h": 1070.1,
      "is_hvac_ducted": false,
      "path": "Sanitary_Makeup",
      "description": "Transfer air into UHD_Head; the head exhausts overboard, never back to the served space."
    },
    {
      "from": "VENT_Hangar",
      "to": "AHU_HD_Firemans_Wash_Rm",
      "flow_rate_m3h": 1664.6,
      "is_hvac_ducted": false,
      "path": "Sanitary_Makeup",
      "description": "Transfer air into Firemans_Wash_Rm; the head exhausts overboard, never back to the served space."
    },
    {
      "from": "VENT_Hangar",
      "to": "AHU_HD_Mens_Wash_Rm",
      "flow_rate_m3h": 1426.8,
      "is_hvac_ducted": false,
      "path": "Sanitary_Makeup",
      "description": "Transfer air into Mens_Wash_Rm; the head exhausts overboard, never back to the served space."
    },
    {
      "from": "VENT_Hangar",
      "to": "AHU_HD_Head_2D",
      "flow_rate_m3h": 1426.8,
      "is_hvac_ducted": false,
      "path": "Sanitary_Makeup",
      "description": "Transfer air into Head_2D; the head exhausts overboard, never back to the served space."
    }
  ],
  "adjacency": [
    {
      "from": "Hangar_Fwd",
      "to": "Flight_Deck",
      "type": "elevator"
    },
    {
      "from": "Hangar_Aft",
      "to": "Flight_Deck",
      "type": "elevator"
    },
    {
      "from": "Nav_Bridge",
      "to": "Flight_Deck",
      "type": "ladder"
    },
    {
      "from": "Bomb_Stowage_2P",
      "to": "Bomb_Stowage_Hold",
      "type": "elevator"
    },
    {
      "from": "Flight_Deck",
      "to": "Drying_Rooms",
      "type": "passageway"
    },
    {
      "from": "Flight_Deck",
      "to": "Watch_Station",
      "type": "passageway"
    },
    {
      "from": "Flight_Deck",
      "to": "Flag_Bridge",
      "type": "passageway"
    },
    {
      "from": "Flight_Deck",
      "to": "Funnel_Uptake",
      "type": "passageway"
    },
    {
      "from": "Flight_Deck",
      "to": "Aerological_Office",
      "type": "passageway"
    },
    {
      "from": "Nav_Bridge",
      "to": "Flag_Bridge",
      "type": "passageway"
    },
    {
      "from": "Nav_Bridge",
      "to": "Funnel_Uptake",
      "type": "passageway"
    },
    {
      "from": "Flag_Bridge",
      "to": "Aerological_Office",
      "type": "passageway"
    },
    {
      "from": "Crews_Space_Mid",
      "to": "General_Mess",
      "type": "passageway"
    },
    {
      "from": "General_Mess",
      "to": "Galley",
      "type": "passageway"
    },
    {
      "from": "Officers_Country",
      "to": "Crew_Berthing_Fwd",
      "type": "passageway"
    },
    {
      "from": "Tool_Room",
      "to": "Parachute_Loft",
      "type": "passageway"
    },
    {
      "from": "Parachute_Loft",
      "to": "Squadron_Office",
      "type": "passageway"
    },
    {
      "from": "Metalsmith_Shop",
      "to": "Torpedo_Shop",
      "type": "passageway"
    },
    {
      "from": "Wardroom_Mess",
      "to": "Bunk_Rooms_Fwd",
      "type": "passageway"
    },
    {
      "from": "Peacoat_Lockers",
      "to": "Armory",
      "type": "passageway"
    },
    {
      "from": "Aviation_Stores_MHD",
      "to": "Crew_Space_Aft_Port",
      "type": "passageway"
    },
    {
      "from": "Warrant_Mess",
      "to": "Officers_Mess_MHD",
      "type": "passageway"
    },
    {
      "from": "Junior_Officers",
      "to": "Captains_Office",
      "type": "passageway"
    },
    {
      "from": "Hangar_Aft",
      "to": "Hangar_Mid",
      "type": "passageway"
    },
    {
      "from": "Hangar_Aft",
      "to": "Sick_Bay",
      "type": "passageway"
    },
    {
      "from": "Hangar_Mid",
      "to": "Hangar_Fwd",
      "type": "passageway"
    },
    {
      "from": "Hangar_Mid",
      "to": "Sick_Bay",
      "type": "passageway"
    },
    {
      "from": "Radio_Bunk_Room",
      "to": "Air_Compressor_2D",
      "type": "passageway"
    },
    {
      "from": "Radio_Bunk_Room",
      "to": "Stores_2D_Aft",
      "type": "passageway"
    },
    {
      "from": "Air_Compressor_2D",
      "to": "Stores_2D_Aft",
      "type": "passageway"
    },
    {
      "from": "Provisions_3D",
      "to": "Bar_Metals",
      "type": "passageway"
    },
    {
      "from": "Provisions_3D",
      "to": "Loading_Machine_Rm",
      "type": "passageway"
    },
    {
      "from": "Loading_Machine_Rm",
      "to": "Aircraft_Parts_Aft",
      "type": "passageway"
    },
    {
      "from": "CPO_Quarters",
      "to": "CPO_Quarters_2",
      "type": "passageway"
    },
    {
      "from": "Stores_Incline",
      "to": "Rags_Waste",
      "type": "passageway"
    },
    {
      "from": "Ice_Machine",
      "to": "Rocket_Motor_Stowage",
      "type": "passageway"
    },
    {
      "from": "Powder_Mag_5in",
      "to": "Machinery_1P",
      "type": "passageway"
    },
    {
      "from": "AA_Mag_40MM",
      "to": "Fire_Control_Workshop",
      "type": "passageway"
    },
    {
      "from": "AA_Mag_40MM",
      "to": "Diesel_Gen_Trunk",
      "type": "passageway"
    },
    {
      "from": "Fire_Control_Workshop",
      "to": "Diesel_Gen_Trunk",
      "type": "passageway"
    },
    {
      "from": "Main_Turbine_Gen_1",
      "to": "Aft_Machinery_2P",
      "type": "passageway"
    },
    {
      "from": "Main_Turbine_Gen_1",
      "to": "Fwd_Machinery_2P",
      "type": "passageway"
    },
    {
      "from": "Aft_Machinery_2P",
      "to": "Rocket_Stowage_2P",
      "type": "passageway"
    },
    {
      "from": "Emerg_Diesel_Gen",
      "to": "Bomb_Stowage_2P",
      "type": "passageway"
    },
    {
      "from": "Packing_Incendiary",
      "to": "Fuel_Oil_2P",
      "type": "passageway"
    },
    {
      "from": "Fire_Room_1",
      "to": "Fire_Room_2",
      "type": "passageway"
    },
    {
      "from": "Fire_Room_1",
      "to": "Thrust_Block_Room",
      "type": "passageway"
    },
    {
      "from": "Fire_Room_2",
      "to": "Fire_Room_3",
      "type": "passageway"
    },
    {
      "from": "Evaporator_Room",
      "to": "Bomb_Stowage_Hold",
      "type": "passageway"
    },
    {
      "from": "Bomb_Stowage_Hold",
      "to": "Small_Arms",
      "type": "passageway"
    }
  ]
}
